{
  "businessPartnerNumber": "BPNL000000000CUT",
  "type": {
    "certificateType": "isoiec27001",
    "certificateVersion": "2022"
  },
  "registrationNumber": "CX-TCK-SET5-NOEXPIRY",
  "areaOfApplication": "Information Security",
  "enclosedSites": [
    {
      "enclosedSiteBpn": "BPNS000000000001",
      "areaOfApplication": "Production"
    }
  ],
  "validFrom": "2024-01-01",
  "validUntil": "9999-12-31",
  "issuer": {
    "issuerName": "CX TCK Certification Body",
    "issuerBpn": "BPNL0000000ISSUE"
  },
  "trustLevel": "trusted",
  "uploader": "BPNL000000000CUT",
  "document": {
    "creationDate": "2025-01-15T09:00:00Z",
    "documentID": "cx-tck-set5-document",
    "contentType": "application/pdf",
    "contentBase64": "JVBERi0xLjQKMSAwIG9iajw8L1R5cGUvQ2F0YWxvZy9QYWdlcyAyIDAgUj4+ZW5kb2JqCjIgMCBvYmo8PC9UeXBlL1BhZ2VzL0tpZHNbMyAwIFJdL0NvdW50IDE+PmVuZG9iagozIDAgb2JqPDwvVHlwZS9QYWdlL1BhcmVudCAyIDAgUi9NZWRpYUJveFswIDAgMjAwIDEwMF0+PmVuZG9iagp0cmFpbGVyPDwvUm9vdCAxIDAgUj4+CiUlRU9GCg=="
  }
}
